{
  "$schema": "http://json-schema.org/draft-07/schema#",
  "type": "object",
  "required": ["work_slug", "pipeline_version", "normalization_version", "text_hash", "entities"],
  "properties": {
    "work_slug": {"type": "string"},
    "pipeline_version": {"type": "string"},
    "normalization_version": {"type": "string"},
    "text_hash": {
      "type": "object",
      "required": ["full_corpus", "per_chapter"],
      "properties": {
        "full": {"type": "string"},
        "full_corpus": {"type": "string"},
        "per_chapter": {"type": "object", "additionalProperties": {"type": "string"}}
      },
      "additionalProperties": false
    },
    "entities": {
      "type": "array",
      "items": {
        "type": "object",
        "required": ["chapter_id", "start", "end", "text", "label", "source", "record_id"],
        "properties": {
          "chapter_id": {"type": "integer"},
          "start": {"type": "integer"},
          "end": {"type": "integer"},
          "text": {"type": "string"},
          "label": {"type": "string"},
          "source": {"type": "string"},
          "record_id": {"type": "string"}
        },
        "additionalProperties": true
      }
    }
  },
  "additionalProperties": true
}
