{
  "entities": [
    {
      "chapter_id": 2,
      "end": 39,
      "label": "ORG",
      "record_id": "6346c2f896488a996b372c84abff12ac55d65f18e478aedf2a940590e75ee4c8",
      "source": "capitalized_fallback",
      "start": 22,
      "text": "The Spacing Guild"
    },
    {
      "chapter_id": 2,
      "end": 68,
      "label": "ORG",
      "record_id": "e83184bbb8455a806251f42176ae51cbaefe6d35fb99b93b66f324c222ec35d9",
      "source": "capitalized_fallback",
      "start": 53,
      "text": "Galactic Empire"
    }
  ],
  "normalization_version": "nfc-crlf2lf-v1",
  "pipeline_version": "0.1.0",
  "text_hash": {
    "full": "5b2242fff678ce7d00a7937da2aa0b4d6e4ae1fdac3e9dbf89ad0644c120dc75",
    "full_corpus": "5b2242fff678ce7d00a7937da2aa0b4d6e4ae1fdac3e9dbf89ad0644c120dc75",
    "per_chapter": {
      "1": "8cb9c4fa162bac045745ae5b48421b81e96021d5c1ac94a11516eac63c596e09",
      "2": "b0dc061fbb0ddcfc1d742e97de549fac3a95f44bf2e062207255a38acbae80af"
    }
  },
  "work_slug": "sample"
}